级别 / 次序 / 数目 + 以上 / 以下<br>十 岁以下的 孩子 不用 买 票 。		- Defining upper and lower limits<br>- To specify 'more than' or 'less than' a certain amount, or 'within' a certain amount, you're going to want to use some of these common words: 以上 (yǐshàng), 以下 (yǐxià), 以内 (yǐnèi), and 以外 (yǐwài). All are 'nouns of locality,' or 方位词 in Chinese.<br>- 以上 and 以下 mean 'more than'/'above' and 'less than'/'below,' respectively. Generally they are non-inclusive, meaning that when you say 十岁以下 you mean 'less than ten years of age,' up to ten, but not including ten years old. In actual usage, however, this fine point may sometimes be fudged a little.<br>- Amount / Level + 以上 / 以下<br>- Literally, 以内 and 以外 mean 'within' and 'outside.' This spatial meaning can be extended to all kinds of abstracted meanings, as you will see below. Note that 以外 often combines with除了.<br>- [Amount / Time / Place / Scope] + 以内 / 以外<br><ruby>两 天以内必须 完成 。<rt>Liǎng tiān yǐnèi bìxū wánchéng.</rt></ruby><br>Must be completed within two days.<br><ruby>半 小时以内能 送到 吗 ？<rt>Bàn xiǎoshí yǐnèi néng sòng dào ma?</rt></ruby><br>Can you deliver in 30 minutes or less?<br><ruby>这个 大楼 50 米以内不 能 停车 。<rt>Zhège dàlóu wǔshí mǐ yǐnèi bù néng tíng chē.</rt></ruby><br>You cannot park within 50 meters of this building.<br><hr>	https://resources.allsetlearning.com/chinese/grammar/ASG7AE5C		{}
随着 A + 的 + Verb， Subj. + Predicate<br>随着经济 的 发展，人们 的 生活 越 来 越 好。		- Expressing 'along with…' with 'suizhe'<br>- 随着 (suízhe) means 'along with,' 'following,' or, more formally, 'in the wake of.' The idea is that one thing is 'following' another, reacting along with it.<br>- Subj. + 随着 + Noun + Verb Phrase<br>- 随着 is one of those words that can have a wide range of translations, all highly dependent upon the context.<br><ruby>树枝随着风 不 停 地 摇动。<rt>Shùzhī suízhe fēng bù tíng de yáodòng.</rt></ruby><br>The branch swayed ceaselessly in the wind.<br><ruby>孩子们随着音乐 跳 起 了 舞。<rt>Háizi men suízhe yīnyuè tiào qǐ le wǔ.</rt></ruby><br>Children started dancing to the music.<br><ruby>污染物随着人 的 呼吸 进入 了 人体 内部 。<rt>Wūrǎn-wù suízhe rén de hūxī jìnrù le réntǐ nèibù.</rt></ruby><br>The pollutants entered the body through inhalation.<br><hr><br>- 随着 can also be used in the following structure to indicate that a change in the first part causes a respective change in the second part. In this case, the first part is typically a general trend, like economic development or rising prices.<br>- 随着 + Trend，Subj. + Predicate<br><ruby>随着经济 的 发展，人们 的 生活 越 来 越 好 了。<rt>Suízhe jīngjì de fāzhǎn, rénmen de shēnghuó yuèláiyuè hǎo le.</rt></ruby><br>With economic development, the people's lives get better and better.<br><ruby>随着石油 价格 的 升高，粮食 的 价格 涨 了 一点。<rt>Suízhe shíyóu jiàgé de shēnggāo, liángshí de jiàgé zhǎng le yīdiǎn.</rt></ruby><br>With the rise in oil prices, the price of grain has also increased a bit.<br><ruby>随着年龄 的 增加，他 变得 更加 成熟 了。<rt>Suízhe niánlíng de zēngjiā, tā biàn de gèngjiā chéngshú le.</rt></ruby><br>As he has gotten older, he has become even more mature.<br><hr>	https://resources.allsetlearning.com/chinese/grammar/ASGHVFRA		{}
(自)从⋯⋯<br>自从来 了 上海 ， 他 就 习惯 了 繁忙 的 生活 。		- Expressing 'ever since' with 'zicong'<br>- 自从 means 'ever since' in English, and is used to express the starting point of an action in the past. It can be followed by phrases using the markers起and以后.<br>- When you need to use 以来 in a more formal or written context, you can add 自,从, or 自从 (or other similar words) before the time or event to make it into a 'sandwich pattern.'<br>- 自从 is used to mark a starting point in time. The same meaning can be expressed with just 从, but 自从 is more formal.<br>- 自从 + [Starting Point] ， ……<br><ruby>自从来 到 湖南，我 越来越 能 吃 辣 了。<rt>Zìcóng lái dào Húnán, wǒ yuèláiyuè néng chī là le .</rt></ruby><br>Ever since arriving in Hunan I've been more and more able to eat spicy food.<br><ruby>自从金融 危机 爆发，就业 市场 越来越 不 景气 了 。<rt>Zìcóng jīnróng wēijī bàofā, jiùyè shìchǎng yuèláiyuè bù jǐngqì le .</rt></ruby><br>Ever since the economic crisis hit the job market has gotten worse and worse.<br><ruby>自从吵 完 架，两 个 人 再 也 没有 说 过 话。<rt>Zìcóng chǎo wán jià, liǎng ge rén zài yě méiyǒu shuō guo huà .</rt></ruby><br>Since their fight the two of them haven't spoken at all.<br><hr><br>- In the above examples, 从 can be used interchangeably with 自从. The main difference is that 从 can also be used to state starting points in the future, a little like 'from' in English. 自从 cannot be used in this way.<br>- Note that 从 can be used to denotestarting points in placeandtime, whereas 自从 canonlybe used to express starting points intime.<br>- 从 / 自从 / 自 + Time / Event + (以)后 / 以来<br>- These words all mean 'from,' with 从 the least formal, 自从 noticeably more formal, and 自 the most formal. At the end of the structure, 以后 is the least formal, followed by 后, with 以来 the most formal.<br><ruby>自从他 跟 我 分手后，他 就 没有 联系 过 我。<rt>Zìcóng tā gēn wǒ fēnshǒu hòu, tā jiù méiyǒu liánxì guo wǒ.</rt></ruby><br>Ever since he broke up with me he hasn't contacted me.<br><ruby>自从用 手机 付款后，我 很 少 带 现金 出门 。<rt>Zìcóng yòng shǒujī fùkuǎn hòu, wǒ hěnshǎo dài xiànjīn chūmén.</rt></ruby><br>Ever since I've started using my phone to pay for stuff I rarely take cash when I go out.<br><ruby>从他 爸爸 去世以来，他 一直 没 回 过 家 。<rt>Cóng tā bàba qùshì yǐlái, tā yīzhí méi huí guo jiā.</rt></ruby><br>He hasn't returned home since his father passed away.<br><hr>	https://resources.allsetlearning.com/chinese/grammar/ASGLI7GW		{}
对 + Person / Group + 而言 ，⋯⋯<br>对消费者而言，促销 活动 很 有 吸引力 。		- Expressing 'for…' with 'eryan'<br>- 对⋯⋯而言 (duì...ér yán) means 'from the point of view of' and is equivalent to but more formal than对⋯⋯来说.<br>- 对 + [Person / Group] + 而言 ，⋯⋯<br><ruby>这样 的 工作对我而言很 重要 。<rt>Zhèyàng de gōngzuò duì wǒ ér yán hěn zhòngyào.</rt></ruby><br>This kind of job, for me, is very important.<br><ruby>对她而言，自由 更 重要 。<rt>Duì tā ér yán, zìyóu gèng zhòngyào.</rt></ruby><br>For her, freedom is even more important.<br><ruby>对80后而言，网恋 很 正常 。<rt>Duì 80 hòu ér yán, wǎngliàn hěn zhèngcháng.</rt></ruby><br>For people born in the eighties, Internet dating is totally normal.<br><hr>	https://resources.allsetlearning.com/chinese/grammar/ASGD2A08		{}
(包括)⋯⋯ 在内 ，⋯⋯<br>包括 水 电 费在内，我 每 个 月 的 房租 三千 五 。		- Expressing 'including' with 'zainei'<br>- The word 在内 can be used as a prepositional phrase meaning 'including.' In addition, the verb 包括 can often be used with 在内 at the beginning of a sentence, equivalent to the English 'including.'<br>- (包括)⋯⋯ 在内 ，⋯⋯<br>- or<br>- ⋯⋯ ，(包括)⋯⋯ 在内<br><ruby>这些 费用 不包括在内。<rt>Zhèxiē fèiyòng bù bāokuò zài nèi.</rt></ruby><br>These fees are not included.<br><ruby>你 把 饭钱包括在内了 吗 ？<rt>Nǐ bǎ fàn qián bāokuò zài nèi le ma?</rt></ruby><br>Did you include your meal stipend?<br><ruby>这 件 事，大家 都 是 有 责任 的，包括政府在内。<rt>Zhè jiàn shì, dàjiā dōu shì yǒu zérèn de, bāokuò zhèngfǔ zài nèi.</rt></ruby><br>Everyone has responsibility in this matter, including the government.<br><hr>	https://resources.allsetlearning.com/chinese/grammar/ASG50341		{}
凭⋯⋯<br>他凭自己 的 努力 成功 。		- Expressing 'on the basis of' with 'ping'<br>- 凭 (píng) is aprepositionthat means 'on the basis of' or 'by virtue of.' Usually the subject of a sentence which makes use of 凭 is a person.<br>- 凭 can be followed up with a noun or noun phrase. The nouns can be something concrete like a passport, diploma, or official ID, or they can be something abstract like experience, efforts, intuition, etc.<br>- 凭 + Noun / Noun Phrase ……<br><ruby>凭护照， 外国 人 可以 买 火车 票。<rt>Píng hùzhào, wàiguó rén kěyǐ mǎi huǒchē piào.</rt></ruby><br>Using a passport, foreigners can buy train tickets.<br><ruby>他凭自己 的 努力 学 了 三千 多 个 汉字。<rt>Tā píng zìjǐ de nǔlì xué le sān qiān duō gè hànzì.</rt></ruby><br>He studied more than three thousand Chinese characters through his own efforts.<br><ruby>我们凭学生证 在 电影院 享受 折扣 优待。<rt>Wǒmen píng xuéshēng zhèng zài diànyǐngyuàn xiǎngshòu zhékòu yōudài.</rt></ruby><br>With our student ID cards, we enjoy a special discount at the movie theater.<br><hr><br>- 凭 can also be used with a verb phrase or subject-predicate phrase as follows:<br>- 凭 + Verb Phrase ……<br><ruby>凭我 学 中文 的 时间 比 你 短 但是 说 得 比 你 好，我 就 可以 说 我 比 你 聪明。<rt>Píng wǒ xué Zhōngwén de shíjiān bǐ nǐ duǎn dànshì shuō de bǐ nǐ hǎo, wǒ jiù kěyǐ shuō wǒ bǐ nǐ cōngming.</rt></ruby><br>From the fact that I have studied Chinese for a shorter time but speak it better than you, I can say that I'm smarter than you.<br><ruby>凭老 李 在 这 一 行 做 了 二十 年，他 就 有 资格 做 你 的 师傅。<rt>Píng Lǎo Lǐ zài zhè yī háng zuò le èrshí nián, tā jiù yǒu zīgé zuò nǐ de shīfu.</rt></ruby><br>On the basis of Lao Li's twenty years of experience in this industry, he is qualified to be your teacher.<br><ruby>他 只凭歌声 就 能 听出 是 谁 唱 的。<rt>Tā zhī píng gēshēng jiù néng tīng chū shì shéi chàng de.</rt></ruby><br>He could tell who was singing just by the sound of the song.<br><hr><br>- This is one of the most common ways to use 凭, especially in spoken Chinese. It often has a feeling of dissatisfaction or anger, perhaps said during an argument. It is like saying, 'On what basis do you ...!?!?' Usually it is paired with blaming, scolding, attacks, etc.<br>- Subj. + 凭什么 + Verb Phrase …… ？！<br><ruby>你凭什么怪 我！<rt>Nǐ píng shénme guài wǒ!</rt></ruby><br>On what grounds are you blaming me?<br><ruby>我 没有 做 错，他凭什么骂 我？<rt>Wǒ méiyǒu zuò cuò, tā píng shénme mà wǒ?</rt></ruby><br>I haven't done anything wrong. What is he yelling at me for?<br><ruby>她 一直 很忠诚， 你凭什么怀疑 她？<rt>Tā yīzhí hěn zhōngchéng, nǐ píng shénme huáiyí tā?</rt></ruby><br>She's always been honest. On what basis are you suspicious of her?<br><hr><br>- You can also add 着 to 凭 to make it 凭着, however when you do so you can only use it if the action has already been completed. If the action occurs habitually or has not happened yet, you cannot use 凭着. The structure is the same as using 凭 by itself.<br>- 凭着 + Noun / Noun Phrase ……<br><ruby>小白凭着自己 的 努力 致富 。<rt>Xiǎo Bái píngzhe zìjǐ de nǔlì zhìfù.</rt></ruby><br>On the basis of his own hard work, Xiao Bai was able to become rich.<br><ruby>他凭着智慧 战胜 了 很 多 的 困难。<rt>Tā píngzhe zhìhuì zhànshèng le hěn duō de kùnnan.</rt></ruby><br>Using his intellect, he was able to overcome many difficulties.<br><hr>	https://resources.allsetlearning.com/chinese/grammar/ASGGB3IV		{}
Receiver + 给 + The Doer + 给 + Verb Phrase<br>事情给解决 了 吗？		- Expressing passive voice with 'gei'<br>- 给 can be used in passive voice constructions. It can either directly replace被or be used together with 被. Compared with 被, 给 is more colloquial and is not used in written language.<br>- 给 can directly replace 被 in theoriginal passive pattern.<br>- Receiver + 给 + The Doer + Verb Phrase<br><ruby>我给他 骗 了。<rt>Wǒ gěi tā piàn le.</rt></ruby><br>I got scammed by him.<br><ruby>这么 好 的 机会给你 浪费 了。<rt>Zhème hǎo de jīhuì gěi nǐ làngfèi le.</rt></ruby><br>Such a great opportunity has been wasted by you.<br><ruby>菜 都给你们 吃 完了 吗？<rt>Cài dōu gěi nǐmen chī wán le ma?</rt></ruby><br>All the food has been finished off by you guys?<br><hr><br>- When using 给 in the passive voice, you can also use it with 被. In this structure 给 gives emphasis to the passive voice. You can find more information at:Advanced uses of 被.<br>- Receiver + 被 + The Doer + 给 + Verb Phrase<br><ruby>我 的 电脑被小明给弄坏 了。<rt>Wǒ de diànnǎo bèi Xiǎo Míng gěi nòng huài le.</rt></ruby><br>My computer was broken by Xiao Ming.<br><ruby>妹妹被这个 电影给吓哭 了。<rt>Mèimei bèi zhège diànyǐng gěi xià kū le.</rt></ruby><br>My younger sister was scared to tears by this movie.<br><ruby>大家 都被这个 新闻给吸引 了。<rt>Dàjiā dōu bèi zhège xīnwén gěi xīyǐn le.</rt></ruby><br>Everyone was attracted by the news.<br><hr>	https://resources.allsetlearning.com/chinese/grammar/ASGEZ2HN		{}
至于 + Topic， Comment<br>你 先 看 产品 。至于价格 ， 我们 再 商量 。		- Expressing 'with regards to' with 'zhiyu'<br>- 至于 (zhìyú), meaning 'with regards to' or 'as to,' is used when the speaker wants to comment on a topic related to the previously discussed one.<br>- This structure is used similarly to 'with regards to' in English. Just put at the beginning of the sentence, before the further comment you want to make.<br>- 至于 + Topic， Comment<br>- Note: 至于 is used after some other discussion or comments. It isnotused to start a new discussion free of context.<br><ruby>项目 方案 我 给 老板 了 。至于老板 同 不 同意，要 看 老板 了。<rt>Xiàngmù fāng'àn wǒ gěi lǎobǎn le. Zhìyú lǎobǎn tóng bu tóngyì, yào kàn lǎobǎn le.</rt></ruby><br>I've given the project proposal to my boss. Iit's up to him whether he agrees or not.<br><ruby>他 足球 踢得 不错，至于篮球，那 就 一般 了。<rt>Tā zúqiú tī de bùcuò, zhìyú lánqiú, nà jiù yībān le.</rt></ruby><br>He is a good soccer player, but just average at basketball.<br><ruby>我 很 喜欢 读书，至于什么 书，没有 限制 。<rt>Wǒ hěn xǐhuan dúshū, zhìyú shénme shū, méiyǒu xiànzhì.</rt></ruby><br>I like reading very much. As for what books, there are no limits.<br><hr>	https://resources.allsetlearning.com/chinese/grammar/ASGZRKTG		{}
就⋯⋯ (来说 / 而言)<br>就我而言， 兴趣 最 重要 。		- Limiting scope with 'jiu'<br>- 'Limiting scope' is like saying, 'what I'm about to say applies to justthis.' You precede the scope with 就 (jiù) in this pattern.<br>- '就” can be placed after the subject to indicate the object or scope of the subject's activities such as observation, discussion, analysis, and explanation.<br>- Subj. + 就 + Scope + Verb + Obj.<br><ruby>两 国 领导人就环保 问题 交换 了 意见。<rt>Liǎng guó lǐngdǎorén jiù huánbǎo wèntí jiāohuàn le yìjiàn.</rt></ruby><br>The two leaders exchanged views on environmental issues.<br><ruby>我就这个 问题 说 两 点 我的 想法。<rt>Wǒ jiù zhège wèntí shuō liǎng diǎn wǒ de xiǎngfǎ.</rt></ruby><br>I would like to make two points on this issue.<br><ruby>大家就中国 互联网 的 发展 发表了 各自 的 看法 。<rt>Dàjiā jiù Zhōngguó hùliánwǎng de fāzhǎn fābiǎo le gèzì de kànfǎ.</rt></ruby><br>Everyone expressed their own thoughts on the development of China's internet.<br><hr><br>- 就 (jiù) can be used to limit the scope of a comment, used in the following structure:<br>- 就 + Topic + [来说 / 而言] + Comment<br>- This emphasizes that the speaker isjustcommenting onthat particular topicand nothing else, like 'just with regards to' in English. In this sense it is similar to至于 (zhìyú), but is generally used to introduce anewidea, rather than to move on from a previous related topic.<br>- Note that in the pattern above, 来说 is more informal, and 而言 is more formal.<br><ruby>就中国 的 独生子女 政策而言，专家 各 有 各 的 看法。<rt>Jiù Zhōngguó de Dúshēngzǐnǚ Zhèngcè ér yán, zhuānjiā gè yǒu gè de kànfǎ.</rt></ruby><br>As for China's One Child Policy, every expert has their own opinion.<br><ruby>就文化大革命而言，大部分 的 人 都 认为 那 是 一 场 灾难。<rt>Jiù Wénhuà Dàgémìng ér yán, dàbùfèn de rén dōu rènwéi nà shì yī chǎng zāinàn.</rt></ruby><br>As for the Cultural Revolution, most of the people think it was a disaster.<br><ruby>就整体而言，这 幅 画 不错，但是 有 一些 细节 还是 要 注意 。<rt>Jiù zhěngtǐ ér yán, zhè fú huà bùcuò, dànshì yǒu yīxiē xìjié háishì yào zhùyì.</rt></ruby><br>As a whole, the painting is not bad, but there are some details that need attention.<br><hr>	https://resources.allsetlearning.com/chinese/grammar/ASG8RW47		{}
趁 + Situation / Opportunity……<br>趁老板 不 在，我们 出去 吃饭 吧。		- Opportune timing with 'chen'<br>- 趁 (chèn) is a preposition that means to 'take advantage of' an opportunity or favorable time to do something. It is normally followed by an adjective or a short phrase explaining the situation that the person is seeking to take advantage of.<br>- 趁 + [Situation / Opportunity]……<br>- Note that in English using the literal translation 'take advantage of' often isn't natural.<br><ruby>趁打折 ，我 买 了 新 手机。<rt>Chèn dǎzhé, wǒ mǎi le xīn shǒujī.</rt></ruby><br>Taking advantage of the discount, I bought a new phone.<br><ruby>趁现在 不 忙，你 快 走 吧。<rt>Chèn xiànzài bùmáng, nǐ kuài zǒu ba.</rt></ruby><br>Go now, while no one is busy.<br><ruby>趁这个 机会 ，我们 见 个 面 吧。<rt>Chèn zhège jīhuì, wǒmen jiàn gè miàn ba.</rt></ruby><br>Let's take this opportunity to meet up.<br><hr>	https://resources.allsetlearning.com/chinese/grammar/ASGI9PNV		{}
Subj. + 并 + 不 + Verb / Adj.<br>当 金融 分析 人员并不是 我 的 梦想。		- Emphasizing a negation with 'bing'<br>- One of the many uses of并(bìng) is to add emphasis to a negative sentence that uses不or没. Because you're emphasizing a negation, 并 is often used when expressing disagreement or pointing out a flaw in someone's argument. While the word 并 is not inherently combative, it can certainly be used that way.<br>- You can take pretty much any sentence with a negated verb and give it a little extra kick with 并. Just put it before the 不 or 没. Note that when used with 不, you can negate an adjective as well.<br>- Subj. + 并 + 不 + Verb / Adj.<br>- Subj. + 并 + 没（有) + Verb<br><ruby>在 中国 创业并不容易，有 很 多 的 挑战。<rt>Zài Zhōngguó chuàngyè bìng bù róngyì, yǒu hěn duō de tiǎozhàn.</rt></ruby><br>In China, starting a business really isn't easy. There are a lot of challenges.<br><ruby>我 在 大学 读 金融 专业，但是 当 金融 分析 人员并不是 我 的 梦想。<rt>Wǒ zài dàxué dú jīnróng zhuānyè, dànshì dāng jīnróng fēnxī rényuán bìng bù shì wǒ de mèngxiǎng.</rt></ruby><br>I'm majoring in finance at the university, but being a financial analyst is not at all my dream.<br><ruby>她 结婚 五年 了，也 生 了 一个 孩子，但 她并不爱 她 丈夫。<rt>Tā jiéhūn wǔ nián le, yě shēng le yī gè háizi, dàn tā bìng bù ài tā zhàngfu.</rt></ruby><br>She's been married for five years and she has a baby, but she doesn't love her husband at all.<br><hr>	https://resources.allsetlearning.com/chinese/grammar/ASGUQUPG		{}
要不是 ⋯⋯ ( 的话 )，⋯⋯<br>要不是你们 迟到 的话，我们 早就 到 了。		- Expressing 'if it were not for' with 'yaobushi'<br>- 要不是 (yàobushì) is almost the same as '如果不是⋯⋯ '， and it may followed by '的话,' meaning 'if it were not for...' or 'without....'<br>- 要不是 ⋯⋯（的话），⋯⋯<br>- The second part of the sentence tellswhat would have happenedotherwise.<br><ruby>要不是你，我 会 迷路。<rt>Yàobùshì nǐ, wǒ huì mílù.</rt></ruby><br>If it weren't for you, I would get lost.<br><ruby>要不是她 帮忙，我们 不 可能 这么 快 找到 这 个 地方。<rt>Yàobùshì tā bāngmáng, wǒmen bù kěnéng zhème kuài zhǎodào zhège dìfang.</rt></ruby><br>We couldn't have found this place so quickly without her help.<br><ruby>要不是你 说 你 想 吃，我 不 会 做 这 个 菜 的。<rt>Yàobùshì nǐ shuō nǐ xiǎng chī, wǒ bù huì zuò zhège cài de.</rt></ruby><br>I wouldn't have made this dish if you hadn't said that you wanted to eat it.<br><hr>	https://resources.allsetlearning.com/chinese/grammar/ASG8F7D4		{}
Good Outcome ，多亏 (了) + Lucky Incident<br>我 没 迟到 ，多亏了你 开车 送 我 。		- Expressing 'thanks to' with 'duokui'<br>- 多亏 (duōkuī) can be translated as 'thanks to' and is used to express that, due to somebody's help, a negative result has been averted. 了 is often placed after it as it's about something that has been completed.<br>- [Good Outcome] ，多亏 (了) + [Lucky Incident]<br><ruby>我 能 这么 快 做完 ，多亏 了你 帮 我 。<rt>Wǒ néng zhème kuài zuò wán, duōkuī le nǐ bāng wǒ.</rt></ruby><br>I was able to finish so quickly thanks to your help.<br><ruby>我 没 迟到 ，多亏 了你 开车 送 我 。<rt>Wǒ méi chídào, duōkuī le nǐ kāichē sòng wǒ.</rt></ruby><br>I wasn't late, thanks to you giving me a ride.<br><ruby>我的 病 很 快 好 了 ，多亏 了妈妈 仔细 照顾 我。<rt>Wǒ de bìng hěn kuài hǎo le, duōkuī le māma zǐxì zhàogù wǒ.</rt></ruby><br>I got well quickly, thanks to my mother's care and attention.<br><hr><br>- When the good outcome comes before 多亏 (as in the pattern above), there is no need to add in 才. But if the good outcome comes after 多亏, you need to add in 才 to indicate 'as a result...(the good outcome happened).' (才 gives the sense that the good outcomewouldn't have happenedwithout that extra help.)<br>- 多亏 (了) + [Lucky Incident] ，Subj. 才 + [Good Outcome]<br><ruby>多亏 了你 开车 送 我 ，我才没 迟到 。<rt>Duōkuī le nǐ kāichē sòng wǒ, wǒ cái méi chídào.</rt></ruby><br>Thanks to your ride, I'm not late to get here.<br><ruby>多亏你 的 伞 ，我才没 淋湿 。<rt>Duōkuī nǐ de sǎn, wǒ cái méi línshī.</rt></ruby><br>Thanks to your umbrella, I didn't get wet.<br><ruby>多亏你 帮 我，我才能 这么 快 做完 。<rt>Duōkuī nǐ bāng wǒ, wǒ cái néng zhème kuài zuò wán.</rt></ruby><br>Thanks to your help, I was able to complete it so quickly.<br><hr><br>- If you want to add in 不然 (bùrán) for an 'otherwise... (this really bad thing would have happened)' explanation, use this structure.<br>- 多亏 (了) + [Lucky Incident] ，不然 + [Bad Outcome]<br>- When translating to English, 'thanks to' doesn't always work as well when you have to add in 'otherwise.'<br><ruby>这 件 事情多亏 了你 的 提醒 ，不然我 肯定 忘 了 。<rt>Zhè jiàn shìqing duōkuī le nǐ de tíxǐng, bùrán wǒ kěndìng wàng le.</rt></ruby><br>Thank you for reminding me about this matter! Otherwise I would definitely have forgetten.<br><ruby>多亏你 送 她 去 医院 ，不然情况 会 很 严重 。<rt>Duōkuī nǐ sòng tā qù yīyuàn, bùrán qíngkuàng huì hěn yánzhòng.</rt></ruby><br>It was a good thing you took her to the hospital, otherwise her condition could have gotten really serious.<br><ruby>多亏 了你 的 建议 ，不然我 真 不 知道 怎么 办 。<rt>Duōkuī le nǐ de jiànyì, bùrán wǒ zhēn bù zhīdào zěnme bàn.</rt></ruby><br>It was a good thing you gave me that suggestion, otherwise I really wouldn't have known what to do.<br><hr><br>- 多亏 (duōkuī) is similar to幸亏 (xìngkuī)in meaning, the major grammatical similarity being that both can be used with 不然 or 才. But there are a few difference between them:	https://resources.allsetlearning.com/chinese/grammar/ASG44TBS		{}
