有的 + Noun<br>派对的时候，有的人在喝酒，有的人在跳舞，还有的人在聊天。		- Using 'youde' to mean 'some'<br>- To refer to justcertainmembers of group, you can use 有的 (yǒude). This usage is normally translated as 'some' in English. It is often used multiple times in one sentence to refer to different groups.<br>- All you need to do is put 有的 (yǒude) before the nouns there are 'some of' in the sentence. If there is already some context, you can omit the subject, and the 有的 (yǒude) can just mean 'some' instead of 'some of something.'<br>- 有的 + (Subj.) + Predicate， 有的 + (Subj.) + Predicate<br>- Also, you aren't limited to just two 有的 (yǒude) in the sentence. You can have multiple groups doing different things, and just precede them with a 有的 (yǒude) each time.<br><ruby>外国人有的很 有钱，有的没钱。<rt>Wàiguó rén yǒude hěn yǒuqián, yǒude méi qián.</rt></ruby><br>Some foreigners are rich, but some aren't.<br><ruby>我们 公司 有 一些 电脑，有的是 新的，有的是 旧的。<rt>Wǒmen gōngsī yǒu yīxiē diànnǎo, yǒude shì xīn de, yǒude shì jiù de.</rt></ruby><br>Our company has some computers. Some are new, and some are old.<br><ruby>他 写 了 很多 书，有的卖 得 很好，有的卖 得 不好。<rt>Tā xiě le hěn duō shū,  yǒude mài de hěn hǎo, yǒude mài de bù hǎo.</rt></ruby><br>He has written a lot of books. Some sell well, but some don't.<br><hr>	https://resources.allsetlearning.com/chinese/grammar/ASG4NDHB		{}
Number + 块 / 元 (+ Number + 毛 / 角) (+ 钱)<br>给 你 五块三毛。		- Counting money<br>- Cash is king, even though China is now crazy for mobile payments. Either way, though, mastering how to say quantities of money is vital!<br>- Before you learn how to count money in Chinese, make sure you know how to ask 'how much money' when you go shopping in China.<br>- Subj. + 多少钱 ?<br><ruby>多少 钱？<rt>Duōshao qián? </rt></ruby><br>How much?<br><ruby>你 的 手机多少 钱？<rt>Nǐ de shǒujī duōshao qián? </rt></ruby><br>How much was your cell phone?<br><ruby>我们 的 午饭多少 钱？<rt>Wǒmen de wǔfàn duōshao qián? </rt></ruby><br>How much is our lunch?<br><hr><br>- Chinese has a specific structure for talking about quantities for money:<br>- Number + 块 + Number + 毛<br><ruby>两块五毛<rt>liǎng kuài wǔ máo</rt></ruby><br>two kuai five mao (2.5)<br><ruby>三块八毛<rt>sān kuài bā máo</rt></ruby><br>three kuai eight mao (3.8)<br><ruby>十块两毛<rt>shí kuài liǎng máo</rt></ruby><br>ten kuai two mao (10.2)<br><hr><br>- Note that '2.5 RMB' reads as 两块五 (liǎng kuài wǔ).<br><hr><br>- If the smaller units are only in tens, you can just say the number of tens. So '3.8 RMB' is 三块八 (sān kuài bā). This way of giving the price is normally only used for amounts under 100 RMB.<br>- When the smallest unit is 2, it reads as 二 (èr) instead of 两 (liǎng).<br><hr><br>- The first number is the amount of whole RMB (or dollars etc.), and the second is the amount smaller units (e.g. cents). So '3.86 RMB' is<br><ruby>三块八 毛 六<rt>sān kuài bā máo liù</rt></ruby><br>three kuai eight mao six fen (3.86)<br><hr><br>- And if there's no smaller unit, e.g. '3 RMB,' you can just say:<br><ruby>三块<rt>sān kuài </rt></ruby><br>Three kuai<br><hr><br>- 块 (kuài) is the more common, informal way to talk about money. More formally you can use 元 (yuán) in exactly the same way. This is similar to the difference between 'dollars' and 'bucks' in American English, or 'pounds' and 'quid' in British English. 块 (kuài) is appropriate in more situations than 'bucks' or 'quid,' though.	https://resources.allsetlearning.com/chinese/grammar/ASGL6JOE		{}
每 + Measure Word (+ Noun)<br>每个 人。每天。		- Expressing 'every' with 'mei'<br>- In this article we will look at the structure for saying 'every' in Chinese, which is slightly more involved than just throwing in the word 每 (měi).<br>- The pronoun 每 (měi) covers the meanings of 'each' and 'every.' It should normally be used with ameasure wordandused with 都 (dōu)in a complete sentence.<br>- 每 + Measure Word + Noun + 都<br>- Note that there are some words that don't use measure words because they themselves are already measure words. For example: 天 (tiān), 年 (nián), 周 (zhōu), 次 (cì) etc.<br><ruby>每个 菜都好吃。<rt>Měi gè cài dōu hěn hǎochī.</rt></ruby><br>Every dish is delicious.<br><ruby>你每个 人都认识 吗？<rt>Nǐ měi gè rén dōu rènshi ma? </rt></ruby><br>Do you know every person? <br><ruby>老板每个 月都出差。<rt>Lǎobǎn měi gè yuè dōu chūchāi.</rt></ruby><br>The boss goes on business trips every month.<br><hr>	https://resources.allsetlearning.com/chinese/grammar/ASGB6L4M		{}
Number + Measure Word + 半 + Noun<br>三 个半小时		- Expressing 'half' with 'ban'<br>- The Chinese word 半 (bàn) means 'half.' That's simple enough, but what can get slightly tricky is the rules for how it combines withmeasure words.<br>- You'll need to use ameasure word(Measure Word) in this structure.<br>- 半 + Measure Word + Noun<br>- Themeasure wordsare also indicated below.<br><ruby>半个小时<rt>bàn gè xiǎoshí</rt></ruby><br>half an hour<br><ruby>半个月<rt>bàn gè yuè</rt></ruby><br>half a month<br><ruby>半碗米饭<rt>bàn wǎn mǐfàn</rt></ruby><br>half a bowl of rice<br><hr><br>- When it's more than just a half, then 半 (bàn) comes after themeasure wordinstead of before. It's the difference between 'half an hour' and 'an hour and a half.'<br><ruby>半个小时<rt>bàn gè xiǎoshí</rt></ruby><br>half an hour<br><ruby>一个半小时<rt>yī gè bàn xiǎoshí</rt></ruby><br>an hour and a half<br><hr><br>- The order is actually basically the same as what we do in English (we just don't have so many pesky measure words to keep track of in English!).<br>- Number + Measure Word + 半 + Noun<br>- There are some words that act as their own measure words, notably the time words 天 (tiān), meaning 'day,' and 年 (nián), meaning 'year.'<br>- 半 + 天 / 年<br><ruby>半天<rt> bàn tiān</rt></ruby><br>half a day<br><ruby>半年<rt> bàn nián</rt></ruby><br>half a year<br><hr><br>- Note that you donotneed to use 个 (gè) here; in fact, it'swrongto do so:<br><hr><br>- 天 (tiān) and 年 (nián) aren't theonlywords that take this alternate pattern, but they're the two key ones you need to learn first.<br>- Number + 天 / 年 + 半<br><ruby>两天半<rt>liǎng tiān bàn</rt></ruby><br>two and a half days<br><ruby>一年半<rt>yī nián bàn</rt></ruby><br>a year and a half<br><ruby>三天半<rt>sān tiān bàn</rt></ruby><br>three and a half days<br><hr>	https://resources.allsetlearning.com/chinese/grammar/ASGAC1P9		{}
Number + Measure Word + Noun<br>一个人。一杯水。		- Measure words for counting<br>- Chinese usesmeasure words, a type of word calledclassifiersin linguistics which are common in East Asian languages. Measure words have a number of important uses, but one of the first ways you'll need to use them is for counting. Chinese learners should master them, starting with the measure word 个 (gè).<br>- Whenever you talk about the quantity of something in Chinese, you need ameasure word.<br>- Number + Measure Word + Noun<br>- English does actually have measure words, it's just that most nouns usually don't need them. In English, most nouns arecount nouns- they specify one instance of something. 'An apple,' for example. Some nouns aremass nounsand refer to something without specifying how much of it there is. Examples are 'furniture,' 'paper,' 'water,' etc. You can't say 'a furniture'; you need a measure word: 'apieceof furniture,' 'twosheetsof paper,' 'threeglassesof water,' and so on.<br>- In Chinese,allnouns aremass nounsso they all need measure words. Just as in English, different nouns are associated with different measure words (e.g. it wouldn't make sense to talk about 'a glass of furniture' unless something went horribly wrong in the factory).<br><ruby>一个人<rt>yī gè rén</rt></ruby><br>a person<br><ruby>两只猫<rt>liǎng zhī māo</rt></ruby><br>two cats<br><ruby>三条鱼<rt>sān tiáo yú</rt></ruby><br>three fish<br><hr><br>- Also remember that there isn't a one-to-one relationship between nouns and measure words. One measure word can be used with several different nouns:<br><ruby>一条狗<rt>yī tiáo gǒu</rt></ruby><br>a dog<br><ruby>一条河<rt>yī tiáo hé</rt></ruby><br>a river<br><ruby>一条路<rt>yī tiáo lù</rt></ruby><br>a road<br><hr><br>- And one noun can take different measure words in different situations:<br><ruby>一块巧克力<rt>yī kuài qiǎokèlì </rt></ruby><br>a piece of chocolate<br><ruby>一盒巧克力<rt>yī hé qiǎokèlì </rt></ruby><br>a box of chocolate<br><ruby>一颗巧克力<rt>yī kē qiǎokèlì </rt></ruby><br>a small piece of chocolate<br><hr>	https://resources.allsetlearning.com/chinese/grammar/ASG64BTE		{}
几 + Measure Word (+ Noun) ?<br>几个人？		- Measure words in quantity questions<br>- Quantity questions are phrases for asking questions like 'how much?' or 'how many?'  You'll need to use thequestion word几 (jǐ) withmeasure wordsfor this.<br>- You can use the quantityquestion word几 (jǐ) instead of a number to ask about quantity withmeasure words.<br>- Subj. + Verb + 几 + Measure Word + Noun？<br><ruby>他 有几个 孩子？<rt>Tā yǒu jǐ gè háizi?</rt></ruby><br>How many kids does he have?<br><ruby>你 家 有几个 房间？<rt>Nǐ jiā yǒu jǐ gè fángjiān?</rt></ruby><br>How many rooms are there in your house?<br><ruby>他们 在 这里 住几个 星期？<rt>Tāmen zài zhèlǐ zhù jǐ gè xīngqī?</rt></ruby><br>How many weeks are they staying here?<br><hr><br>- When the number is not certain but you assume it's definitely more than ten, it's better to ask the question with 多少 (duōshao) instead of 几 (jǐ).<br>- Subj. + Verb + 多少 + Measure Word + Noun ？<br><ruby>你 去 过多少个 国家？<rt>Nǐ qù guo duōshao gè guójiā?</rt></ruby><br>How many countries have you been to?<br><ruby>你们 班 有多少个 学生？<rt>Nǐmen bān yǒu duōshao gè xuéshēng?</rt></ruby><br>How many students are there in your class?<br><ruby>你 大学 的 时候 看 了多少本 书？<rt>Nǐ dàxué de shíhou kàn le duōshao běn shū?</rt></ruby><br>How many books did you read when you were in college? <br><hr>	https://resources.allsetlearning.com/chinese/grammar/ASGL9KQM		{}
这 / 那 + Measure Word (+ Noun)<br>那个人。这杯水。		- Measure words with 'this' and 'that'<br>- In English, when you refer to 'this table' or 'that girl' you only need two words: 'this' or 'that' plus the noun you're referring to.  In Chinese, though, you also need ameasure wordin the middle between the two.  In the very beginning you can get away with using个 (gè)for everything, but pretty soon you're going to have to start using other measure words in these simple phrases.<br>- If you use 这 (zhè) or 那 (nà) before a noun, you also need to include ameasure wordbefore the noun.<br>- 这 / 那 + Measure Word + Noun<br>- Note: In this usage, the tone of 个 (gè) tends to soften, so it's represented below as a neutral tone.<br><ruby>那个人<rt> nàge rén</rt></ruby><br>that person<br><ruby>这本书<rt> zhè běn shū</rt></ruby><br>this book<br><ruby>那件事<rt> nà jiàn shì</rt></ruby><br>that matter (in the sense of business, affair, or thing)<br><hr><br>- Although we didn't get into it here, the same pattern holds true when you use 哪 (nǎ) to ask 'which?'	https://resources.allsetlearning.com/chinese/grammar/ASGZC42B		{}
第 + Number (+ Measure Word)<br>你 是 我 的第 一个朋友。		- Ordinal numbers with 'di'<br>- We use ordinal numbers to express things like 'number one' or 'second,' so mastering them in Chinese is important. Fortunately, they are also very easy to learn by just adding the prefix 第 (dì).<br>- In English, there are four different suffixes for ordinal numbers:-st,-nd,-rdand-th. Chinese makes things a lot simpler by using one prefix for all ordinal numbers: 第 (dì). This character is simply placed in front of the number:<br>- 第 + Number<br>- You can also add in ameasure wordand anounto make the structure a bit fuller.<br>- 第 + Number + Measure Word + Noun<br><ruby>我 是第 一个到 公司 的 人。<rt>Wǒ shì dì-yī gè dào gōngsī de rén.</rt></ruby><br>I'm the first person that came to the office.<br><ruby>他 要 坐 早上第 一班地铁 去 上班。<rt>Tā yào zuò zǎoshang dì-yī  bān dìtiě qù shàngbān.</rt></ruby><br>He needs to take the first train in the morning to go to work.<br><ruby>小李 是 她 的第 三个男朋友。<rt>Xiǎo Lǐ shì tā de dì-sān gè nánpéngyou.</rt></ruby><br>Little Li is her third boyfriend.<br><hr><br>- Note that there are some words that don't use measure words because they themselves are already measure words. For example: 天 (tiān), 年 (nián), 周 (zhōu), 次 (cì), etc.<br><ruby>第 一天，我们 在 宾馆 里。<rt>Dì-yī tiān, wǒmen zài bīnguǎn lǐ.</rt></ruby><br>On the first day, we will be in the hotel.<br><ruby>来 上海 以后 的第 二年，他 开 了 这 家 公司。<rt>Lái Shànghǎi yǐhòu de dì-èr nián,  tā kāi le zhè jiā gōngsī.</rt></ruby><br>He started this company his second year after coming to Shanghai.<br><ruby>下 个 月 的第 一周老板 要 出差。<rt>Xià gè yuè de dì-yī zhōu , lǎobǎn yào chūchāi.</rt></ruby><br>The boss needs to go on a business trip the first week of next month.<br><hr><br>- Note that some nouns can form ordinals without 第 (dì). With these, the number can be used directly. For example, 七楼 (qī lóu) is 'the seventhfloor,' even though there is no 第 (dì).	https://resources.allsetlearning.com/chinese/grammar/ASGK904U		{}
⋯⋯怎么样？<br>你 最近怎么样？		- Asking how something is with 'zenmeyang'<br>- You may know that怎么 (zěnme) can mean 'how', but by adding to it and making it 怎么样 (zěnmeyàng), you can askhow something is, orwhat it is like. This is useful in all manner of conversations, and is essential for building conversation skills.<br>- This question form is super simple. It is similar to asking  the question, 'how is...?'<br>- Subj. + 怎么样 ?<br>- Many of these sample sentences are super common in everyday life, so it's a good idea to get familiar with them.<br><ruby>你 最近怎么样？<rt>Nǐ zuìjìn zěnmeyàng ? </rt></ruby><br>How have you been recently?<br><ruby>中国怎么样？<rt>Zhōngguò zěnmeyàng ? </rt></ruby><br>How is China?<br><ruby>北京 冬天怎么样？<rt>Běijīng dōngtiān zěnmeyàng ? </rt></ruby><br>How is Beijing in the winter?<br><hr><br>- In this pattern,  you're directly asking for an opinion in an open-ended way.<br>- 你 觉得 + Topic + 怎么样 ?<br>- This is like asking, 'what do you think of...?'<br><ruby>你 觉得上海怎么样？<rt>Nǐ juéde Shànghǎi  zěnmeyàng ? </rt></ruby><br>What do you think of Shanghai?<br><ruby>你 觉得我怎么样？<rt>Nǐ juéde  wǒ zěnmeyàng ? </rt></ruby><br>What do you think of me?<br><ruby>你 觉得中文怎么样？ 难学 吗 ？<rt>Nǐ juéde Zhōngwén zěnmeyàng?  Nánxué ma? </rt></ruby><br>What do you think of Chinese? Is it difficult to learn?<br><hr>	https://resources.allsetlearning.com/chinese/grammar/ASGC701A		{}
怎么⋯⋯？<br>你怎么没 来？		- Asking why with 'zenme'<br>- Aside fromjust meaning 'how,'怎么 (zěnme) can also be used to ask 'why' or 'how come.'<br>- Similar to the question word为什么(wèishénme), questions can also be asked with 怎么 (zěnme).<br>- Subj. + 怎么 + Verb + Obj. ?<br>- This has similar connotations to saying 'how come' in English. It not only asks why, but expresses some surprise at the situation, and in some cases even disagreement with it.<br><ruby>他怎么还 没 来 ？<rt>Tā zěnme hái méi lái? </rt></ruby><br>How come he's not here yet?<br><ruby>你们怎么打 人？<rt>Nǐmen zěnme dǎ rén? </rt></ruby><br>How can you hit people? <br><ruby>他 帮 了 你，你怎么不 说 “谢谢” ？<rt>Tā bāng le nǐ, nǐ zěnme bù shuō 'xièxie'? </rt></ruby><br>He helped you. How come you didn't say thank you? <br><hr><br>- In this case,  it's most common to negate the adjective after 怎么 (zěnme).<br>- Subj. + 怎么 (+ 不) + Adj.<br><ruby>水怎么不 热？<rt>Shuǐ zěnme bù rè? </rt></ruby><br>Why is the water not hot? <br><ruby>这里 的 川菜怎么不 辣？<rt>Zhèlǐ de chuāncài zěnme bù là? </rt></ruby><br>Why is the Sichuan food here not spicy? <br><ruby>他 亲 了 你，你怎么不 高兴 ？<rt>Tā qīn le nǐ, nǐ zěnme bù gāoxìng? </rt></ruby><br>He kissed you. How come you're not happy? <br><hr><br>- One pattern this use of 怎么 (zěnme) frequently appears in is with 这么 (zhème) or 那么 (nàme). (For more on 这么 (zhème) and 那么 (nàme), seeadjectives with 'name' and 'zheme.')<br>- Subj. + 怎么 + 这么 / 那么 + Adj.<br>- This use of 怎么 (zěnme) could be translated as either 'how' or 'why'; the actual meaning sort of falls in the fuzzy region between the two.  In any case, it's used to express disbelief:how can (something) be so (adjective)?!<br><ruby>他怎么那么 懒？<rt>Tā zěnme nàme lǎn? </rt></ruby><br>How can he be this lazy? <br><ruby>昨天怎么那么 冷？<rt>Zuótiān zěnme nàme lěng? </rt></ruby><br>How could it be so cold yesterday? <br><ruby>这些人怎么这么 吵？<rt>Zhèxiē rén zěnme zhème chǎo? </rt></ruby><br>How can these people so loud? <br><hr>	https://resources.allsetlearning.com/chinese/grammar/ASGD7NS3		{}
Verb + 了 + 吗？<br>你 吃饭了 吗？		- Questions with 'le ma'<br>- Asking questions about completed actions will involve using both 了 (le) and 吗 (ma). These are simply added to the end of a sentence or statement. Just make sure that 了 (le) comes first, followed by 吗 (ma).<br>- Subj. + Verb + Obj. + 了吗?<br>- Note the order of 了 (le) and 吗 (ma).<br><ruby>你 吃饭了 吗？<rt>Nǐ chīfàn le ma? </rt></ruby><br>Did you eat? <br><ruby>老板 走了 吗？<rt>Lǎobǎn zǒu le ma? </rt></ruby><br>Did the boss leave? <br><ruby>你男朋友 找到 新 工作了 吗？<rt>Nǐ nánpéngyou zhǎodào xīn gōngzuò le ma? </rt></ruby><br>Has your boyfriend found a new job yet? <br><hr><br>- Topic (+ Subj.) + Verb + 了吗?<br>- NOTE: in this structure, the topic is also the object for the verb.<br><ruby>晚饭 你 吃了 吗？<rt>Wǎnfàn nǐ chī le ma? </rt></ruby><br>Did you eat dinner? <br><ruby>衣服 你 洗 好了 吗？<rt>Yīfu nǐ xǐ hǎo le ma? </rt></ruby><br>Have you finished washing the clothes? <br><ruby>作业 你 写 完了 吗？<rt>Zuòyè nǐ xiě wán  le ma? </rt></ruby><br>Have you finishing doing homework? <br><hr><br>- Finally, please note that this pattern is nothing more than the combination of theexpressing completion with 'le'pattern and theyes/no questions with 'ma'pattern.	https://resources.allsetlearning.com/chinese/grammar/ASGYKDNF		{}
因为⋯⋯ 所以⋯⋯<br>因为饿 了，所以吃饭。		- Cause and effect with 'yinwei' and 'suoyi'<br>- You will often come across 因为⋯⋯所以⋯⋯ (yīnwèi... suǒyǐ...) in both written and spoken Chinese. This pattern will give your Chinese a clear logical structure, and can help make you more persuasive.<br>- A common way to explain causes in Chinese is with 因为 (yīnwèi). This is equivalent to 'because' in English. Usually 因为 (yīnwèi) will begin a new phrase in a sentence.<br>- In this structure, we first state the result, and then give the reason in the next statement after the 因为 (yīnwèi).<br>- Result, 因为 + Reason<br><ruby>他 学 得 很 快 ，因为他 很 聪明 。<rt>Tā xué de hěn kuài, yīnwèi tā hěn cōngming.</rt></ruby><br>He learns fast because he is smart.<br><ruby>我 爱 吃 四川 菜 ，因为很 辣 。<rt>Wǒ ài chī Sìchuān cài, yīnwèi hěn là.</rt></ruby><br> I love eating Sichuan food because it's very spicy.<br><ruby>我 在 学习 中文 ，因为我 想 去 中国 。<rt>Wǒ zài xuéxí Zhōngwén, yīnwèi wǒ xiǎng qù Zhōngguó.</rt></ruby><br>I am studying Chinese because I want to go to China.<br><hr><br>- Just as 因为 (yīnwèi) can be used to explain causes, 所以 (suǒyǐ) can be used to explain results. This is the equivalent of 'so…' or 'therefore…' in English.<br>- This pattern is similar to the expression using both 因为 (yīnwèi) and 所以 (suǒyǐ), but it leaves out the beginning 因为 (yīnwèi). This structure is more informal.<br>- Reason, 所以 + Result<br><ruby>汉字 太 难 了，所以我 不 想 学 。<rt>Hànzì tài nán le, suǒyǐ wǒ bù xiǎng xué.</rt></ruby><br>Chinese characters are too hard, so I don't want to study them.<br><ruby>她 很 漂亮，所以很 多 男孩 喜欢 她。<rt>Tā hěn piàoliang, suǒyǐ hěn duō nánhái xǐhuan tā.</rt></ruby><br>She is beautiful, so a lot of boys like her.<br><ruby>他 找到 工作 了，所以很 高兴。<rt>Tā zhǎodào gōngzuò le, suǒyǐ hěn gāoxìng.</rt></ruby><br>He found a job so he's happy.<br><hr><br>- The full pattern 因为……所以…… (yīnwèi... suǒyǐ...) is used to clearly indicate cause and effect. They could be thought of as equating to: 'Since ___ happened, so ___ happened.' It sounds weird to use both 'since' and 'so' in one sentence in English, but it makes everything crystal clear in Chinese.<br>- 因为 + Cause, 所以 + Effect<br>- This expresses that because ofcause, therefore there is aresult.<br><ruby>因为我 有 一个 中国 女朋友，所以我 要 学 中文。<rt>Yīnwèi wǒ yǒu yī gè Zhōngguó nǚpéngyou, suǒyǐ wǒ yào xué Zhōngwén.</rt></ruby><br>Since I have a Chinese girlfriend, I need to study Chinese.<br><ruby>因为他 生病 了，所以没 去 上课。<rt> Yīnwèi tā shēngbìng le, suǒyǐ méi qù shàngkè.</rt></ruby><br>Since he was sick, he didn't go to class.<br><ruby>因为我 很 累，所以要 休息。<rt>Yīnwèi wǒ hěn lèi, suǒyǐ yào xiūxi.</rt></ruby><br>I'm very tired, so I want to rest.<br><hr>	https://resources.allsetlearning.com/chinese/grammar/ASGTDUJO		{}
快 + Verb / Adj. + 了<br>快下雨了。		- Expressing 'about to happen' with 'le'<br>- Remember that 了 (le) is not only for the past! When something isabout to happen,you can also indicate this using 了 (le).  Normally it is paired with a 快 (kuài), 快要(kuàiyào) or a 要 (yào). This is a special form ofusing 了 to indicate a change of situation.<br>- When using 快 ⋯⋯了 (kuài... le) withverbs, it takes on a meaning similar to the English 'just about to.' Normally you can add 要 (yào) before the verb.<br>- 快+ Verb + 了<br>- 快要 + Verb + 了<br><ruby>我们快到了。<rt>Wǒmen kuài dào le.</rt></ruby><br>We're almost there.<br><ruby>快下雨了。<rt>Kuài xiàyǔ le.</rt></ruby><br>It's going to rain soon.<br><ruby>快 要过年了，你 什么 时候 回家？<rt>Kuài yào guònián le, nǐ shénme shíhou huíjiā? </rt></ruby><br>It's almost Chinese New Year. When are you going back to your hometown?<br><hr><br>- Notice that for some translations, it's more natural to use the English word 'almost' instead of 'soon.'<br>- In this structure, 快⋯⋯了 (kuài... le) is closer to the meaning of 'almost' in English.<br>- 快 + Adj. + 了<br><ruby>天快黑了。<rt>Tiān kuài hēi le.</rt></ruby><br>It’s almost getting dark.<br><ruby>我快好了。<rt>Wǒ kuài hǎo le.</rt></ruby><br>I'm almost ready.<br><ruby>饭快凉了。<rt>Fàn kuài liáng le.</rt></ruby><br>The food is about to be cold.<br><hr><br>- You can also just use 要 (yào) before the verb, without 快 (kuài).<br>- Subj. + 要 + Verb / Adj. + 了<br>- Note that occasionally you'll seeadjectives(instead of verbs) in this pattern as well.<br><ruby>我要生气了！<rt>Wǒ yào shēngqì le!</rt></ruby><br>I'm going to get angry! <br><ruby>他们 的 孩子要出生了。<rt>Tāmen de háizi yào chūshēng le.</rt></ruby><br>Their child is about to be born.<br><ruby>9 点 了，超市要关门了。<rt>Jiǔ diǎn le, chāoshì yào guānmén le.</rt></ruby><br>It's 9 o'clock. The supermarket is about to close.<br><hr>	https://resources.allsetlearning.com/chinese/grammar/ASGNGEU8		{}
